<?xml version="1.0" encoding="UTF-8"?>
<?xml-stylesheet type="text/xsl" href="/style/human.xsl"?>
<thesaurus dc:URI='http://gensc.org/ns/mixs/terms/vocabulary/contam_screen_input/'
  dc:description="The contamination screening input Vocabulary is a recommended set of values to use for the contam_screen_input term in the MIxS Extension."
  dc:title="Genomic Standards Consortium contamination screening input Vocabulary"
  dc:issued="2020-04-24"
  dc:relation=""
  xmlns="http://rs.gbif.org/thesaurus/"
  xmlns:dc="http://purl.org/dc/terms/"
  xmlns:xsi="http://www.w3.org/2001/XMLSchema-instance"
  xsi:schemaLocation="http://rs.gbif.org/thesaurus/  http://rs.gbif.org/schema/thesaurus.xsd">
  <concept dc:identifier="reads"
    dc:URI='http://gensc.org/ns/mixs/terms/vocabulary/contam_screen_input/reads'
    dc:description="">
    <preferred>
      <term dc:source="Genomic Standards Consortium MIxS Data Standard"
        dc:title="reads"
        xml:lang="en"/>
    </preferred>
    <alternative></alternative>
  </concept>
  <concept dc:identifier="contigs"
    dc:URI='http://gensc.org/ns/mixs/terms/vocabulary/contam_screen_input/contigs'
    dc:description="">
    <preferred>
      <term dc:source="Genomic Standards Consortium MIxS Data Standard"
        dc:title=" contigs"
        xml:lang="en"/>
    </preferred>
    <alternative></alternative>
  </concept>
</thesaurus>
    