<?xml version="1.0" encoding="UTF-8"?>
<?xml-stylesheet type="text/xsl" href="/style/human.xsl"?>
<thesaurus dc:URI='http://gensc.org/ns/mixs/terms/vocabulary/tax_ident/'
  dc:description="The taxonomic identity marker Vocabulary is a recommended set of values to use for the tax_ident term in the MIxS Extension."
  dc:title="Genomic Standards Consortium taxonomic identity marker Vocabulary"
  dc:issued="2020-04-24"
  dc:relation=""
  xmlns="http://rs.gbif.org/thesaurus/"
  xmlns:dc="http://purl.org/dc/terms/"
  xmlns:xsi="http://www.w3.org/2001/XMLSchema-instance"
  xsi:schemaLocation="http://rs.gbif.org/thesaurus/  http://rs.gbif.org/schema/thesaurus.xsd">
  <concept dc:identifier="16_s_r_rna_gene"
    dc:URI='http://gensc.org/ns/mixs/terms/vocabulary/tax_ident/16_s_r_rna_gene'
    dc:description="">
    <preferred>
      <term dc:source="Genomic Standards Consortium MIxS Data Standard"
        dc:title="16S rRNA gene"
        xml:lang="en"/>
    </preferred>
    <alternative></alternative>
  </concept>
  <concept dc:identifier="multi_marker_approach"
    dc:URI='http://gensc.org/ns/mixs/terms/vocabulary/tax_ident/multi_marker_approach'
    dc:description="">
    <preferred>
      <term dc:source="Genomic Standards Consortium MIxS Data Standard"
        dc:title="multi-marker approach"
        xml:lang="en"/>
    </preferred>
    <alternative></alternative>
  </concept>
  <concept dc:identifier="other"
    dc:URI='http://gensc.org/ns/mixs/terms/vocabulary/tax_ident/other'
    dc:description="">
    <preferred>
      <term dc:source="Genomic Standards Consortium MIxS Data Standard"
        dc:title="other"
        xml:lang="en"/>
    </preferred>
    <alternative></alternative>
  </concept>
</thesaurus>
    