<?xml version='1.0' encoding='UTF-8'?>
<?xml-stylesheet type='text/xsl' href='/style/human.xsl'?>
<thesaurus
  dc:URI='http://rs.tdwg.org/dwc/dwctype/'
  dc:description='The specific nature of the data record.'
  dc:title='Darwin Core Basis of Record Vocabulary'
  dc:issued='2023-09-14'
  dc:relation='https://dwc.tdwg.org/terms/#dwc:basisOfRecord'
  xmlns='http://rs.gbif.org/thesaurus/'
  xmlns:dc='http://purl.org/dc/terms/'
  xmlns:xsi='http://www.w3.org/2001/XMLSchema-instance'
  xsi:schemaLocation='http://rs.gbif.org/thesaurus/ http://rs.gbif.org/schema/thesaurus.xsd'>

  <concept
    dc:identifier='PreservedSpecimen'
	dc:URI='http://rs.tdwg.org/dwc/dwctype/PreservedSpecimen'
	dc:subject='http://rs.tdwg.org/dwc/terms/PreservedSpecimen'
    dc:relation='https://dwc.tdwg.org/terms/#preservedspecimen'
    dc:issued='2018-09-06'
    comments=''
    dc:description='A specimen that has been preserved.'>
    <preferred>
      <term dc:source='Darwin Core' dc:title='Preserved Specimen' xml:lang='en'/>
      <term dc:source='Darwin Core' dc:title='Espécime Preservado' xml:lang='pt'/>
      <term dc:source='Darwin Core' dc:title='Espécimen preservado' xml:lang='es'/>
      <term dc:source='Darwin Core' dc:title='保存標本' xml:lang='ja'/>
    </preferred>
    <alternative>
    </alternative>
  </concept>

  <concept
    dc:identifier='FossilSpecimen'
	dc:URI='http://rs.tdwg.org/dwc/dwctype/FossilSpecimen'
	dc:subject='http://rs.tdwg.org/dwc/terms/FossilSpecimen'
    dc:relation='https://dwc.tdwg.org/terms/#fossilspecimen'
    dc:issued='2018-09-06'
    comments=''
    dc:description='A preserved specimen that is a fossil.'>
    <preferred>
      <term dc:source='Darwin Core' dc:title='Fossil Specimen' xml:lang='en'/>
      <term dc:source='Darwin Core' dc:title='Espécime Fóssil' xml:lang='pt'/>
      <term dc:source='Darwin Core' dc:title='Espécimen fósil' xml:lang='es'/>
      <term dc:source='Darwin Core' dc:title='化石標本' xml:lang='ja'/>
    </preferred>
    <alternative>
    </alternative>
  </concept>

  <concept
    dc:identifier='LivingSpecimen'
	dc:URI='http://rs.tdwg.org/dwc/dwctype/LivingSpecimen'
	dc:subject='http://rs.tdwg.org/dwc/terms/LivingSpecimen'
    dc:relation='https://dwc.tdwg.org/terms/#livingspecimen'
    dc:issued='2018-09-06'
    comments=''
    dc:description='A specimen that is alive.'>
    <preferred>
      <term dc:source='Darwin Core' dc:title='Living Specimen' xml:lang='en'/>
      <term dc:source='Darwin Core' dc:title='Espécime Vivo' xml:lang='pt'/>
      <term dc:source='Darwin Core' dc:title='Espécimen vivo' xml:lang='es'/>
      <term dc:source='Darwin Core' dc:title='生体標本' xml:lang='ja'/>
    </preferred>
    <alternative>
    </alternative>
  </concept>

  <concept
    dc:identifier='HumanObservation'
	dc:URI='http://rs.tdwg.org/dwc/dwctype/HumanObservation'
	dc:subject='http://rs.tdwg.org/dwc/terms/HumanObservation'
    dc:relation='https://dwc.tdwg.org/terms/#humanobservation'
    dc:issued='2018-09-06'
    comments=''
    dc:description='An output of a human observation process.'>
    <preferred>
      <term dc:source='Darwin Core' dc:title='Human Observation' xml:lang='en'/>
      <term dc:source='Darwin Core' dc:title='Observação por Humano' xml:lang='pt'/>
      <term dc:source='Darwin Core' dc:title='Observación humana' xml:lang='es'/>
      <term dc:source='Darwin Core' dc:title='人による観察' xml:lang='ja'/>
    </preferred>
    <alternative>
    </alternative>
  </concept>

  <concept
    dc:identifier='MachineObservation'
	dc:URI='http://rs.tdwg.org/dwc/dwctype/MachineObservation'
	dc:subject='http://rs.tdwg.org/dwc/terms/MachineObservation'
    dc:relation='https://dwc.tdwg.org/terms/#machineobservation'
    dc:issued='2018-09-06'
    comments=''
    dc:description='An output of a machine observation process.'>
    <preferred>
      <term dc:source='Darwin Core' dc:title='Machine Observation' xml:lang='en'/>
      <term dc:source='Darwin Core' dc:title='Observação por Máquina' xml:lang='pt'/>
      <term dc:source='Darwin Core' dc:title='Observación con máquina' xml:lang='es'/>
      <term dc:source='Darwin Core' dc:title='機械観測' xml:lang='ja'/>
    </preferred>
    <alternative>
    </alternative>
  </concept>

  <concept
    dc:identifier='MaterialEntity'
	dc:URI='http://rs.tdwg.org/dwc/dwctype/MaterialEntity'
	dc:subject='http://rs.tdwg.org/dwc/terms/MaterialEntity'
    dc:relation='https://dwc.tdwg.org/terms/#materialentity'
    dc:issued='2023-09-14'
    comments=''
    dc:description='An entity that can be identified, exists for some period of time, and consists in whole or in part of physical matter while it exists.'>
    <preferred>
      <term dc:source='Darwin Core' dc:title='Material Entity' xml:lang='en'/>
      <term dc:source='Darwin Core' dc:title='Entidad Material' xml:lang='pt'/>
      <term dc:source='Darwin Core' dc:title='Entidade Material' xml:lang='es'/>
      <term dc:source='Darwin Core' dc:title='物質的な実体' xml:lang='ja'/>
    </preferred>
    <alternative>
    </alternative>
  </concept>

  <concept
    dc:identifier='MaterialSample'
	dc:URI='http://rs.tdwg.org/dwc/dwctype/MaterialSample'
	dc:subject='http://rs.tdwg.org/dwc/terms/MaterialSample'
    dc:relation='https://dwc.tdwg.org/terms/#materialsample'
    dc:issued='2023-09-14'
    comments=''
    dc:description='A material entity that represents an entity of interest in whole or in part.'>
    <preferred>
      <term dc:source='Darwin Core' dc:title='Material Sample' xml:lang='en'/>
      <term dc:source='Darwin Core' dc:title='Amostra' xml:lang='pt'/>
      <term dc:source='Darwin Core' dc:title='Muestra' xml:lang='es'/>
      <term dc:source='Darwin Core' dc:title='試料' xml:lang='ja'/>
    </preferred>
    <alternative>
      <term dc:title='Sample' xml:lang='en'/>
    </alternative>
  </concept>

  <concept
    dc:identifier='Occurrence'
	dc:URI='http://rs.tdwg.org/dwc/dwctype/Occurrence'
	dc:subject='http://rs.tdwg.org/dwc/terms/Occurrence'
    dc:relation='https://dwc.tdwg.org/terms/#occurrence'
    dc:issued='2018-09-06'
    comments=''
    dc:description='An existence of an Organism (sensu http://rs.tdwg.org/dwc/terms/Organism) at a particular place at a particular time.'>
    <preferred>
      <term dc:source='Darwin Core' dc:title='Occurrence' xml:lang='en'/>
      <term dc:source='Darwin Core' dc:title='Ocorrência' xml:lang='pt'/>
      <term dc:source='Darwin Core' dc:title='Observación' xml:lang='es'/>
      <term dc:source='Darwin Core' dc:title='オカレンス' xml:lang='ja'/>
    </preferred>
    <alternative>
    </alternative>
  </concept>

  <concept
    dc:identifier='MaterialCitation'
	dc:URI='http://rs.tdwg.org/dwc/dwctype/MaterialCitation'
	dc:subject='http://rs.tdwg.org/dwc/terms/MaterialCitation'
    dc:relation='https://dwc.tdwg.org/terms/#materialcitation'
    dc:issued='2021-07-15'
    comments=''
    dc:description='A reference to or citation of one, a part of, or multiple specimens in scholarly publications.'>
    <preferred>
      <term dc:source='Darwin Core' dc:title='Material Citation' xml:lang='en'/>
    </preferred>
    <alternative>
      <term dc:title='Literature' xml:lang='en'/>
    </alternative>
  </concept>

</thesaurus>
