<?xml version="1.0" encoding="UTF-8"?>
<?xml-stylesheet type="text/xsl" href="/style/human.xsl"?>
<thesaurus dc:URI='http://gensc.org/ns/mixs/terms/vocabulary/virus_enrich_appr/'
    dc:description="The virus enrichment approach Vocabulary is a recommended set of values to use for the virus_enrich_appr term in the MIxS Extension."
    dc:title="Genomic Standards Consortium virus enrichment approach Vocabulary"
    dc:issued="2020-04-24"
    dc:relation=""
    xmlns="http://rs.gbif.org/thesaurus/"
    xmlns:dc="http://purl.org/dc/terms/"
    xmlns:xsi="http://www.w3.org/2001/XMLSchema-instance"
    xsi:schemaLocation="http://rs.gbif.org/thesaurus/  http://rs.gbif.org/schema/thesaurus.xsd">
    <concept dc:identifier="filtration"
        dc:URI='http://gensc.org/ns/mixs/terms/vocabulary/virus_enrich_appr/filtration'
        dc:description="">
        <preferred>
            <term dc:source="Genomic Standards Consortium MIxS Data Standard"
                dc:title="filtration"
                xml:lang="en"/>
        </preferred>
        <alternative></alternative>
    </concept>
    <concept dc:identifier="ultrafiltration"
        dc:URI='http://gensc.org/ns/mixs/terms/vocabulary/virus_enrich_appr/ultrafiltration'
        dc:description="">
        <preferred>
            <term dc:source="Genomic Standards Consortium MIxS Data Standard"
                dc:title="ultrafiltration"
                xml:lang="en"/>
        </preferred>
        <alternative></alternative>
    </concept>
    <concept dc:identifier="centrifugation"
        dc:URI='http://gensc.org/ns/mixs/terms/vocabulary/virus_enrich_appr/centrifugation'
        dc:description="">
        <preferred>
            <term dc:source="Genomic Standards Consortium MIxS Data Standard"
                dc:title="centrifugation"
                xml:lang="en"/>
        </preferred>
        <alternative></alternative>
    </concept>
    <concept dc:identifier="ultracentrifugation"
        dc:URI='http://gensc.org/ns/mixs/terms/vocabulary/virus_enrich_appr/ultracentrifugation'
        dc:description="">
        <preferred>
            <term dc:source="Genomic Standards Consortium MIxS Data Standard"
                dc:title="ultracentrifugation"
                xml:lang="en"/>
        </preferred>
        <alternative></alternative>
    </concept>
    <concept dc:identifier="peg_precipitation"
        dc:URI='http://gensc.org/ns/mixs/terms/vocabulary/virus_enrich_appr/peg_precipitation'
        dc:description="">
        <preferred>
            <term dc:source="Genomic Standards Consortium MIxS Data Standard"
                dc:title="PEG Precipitation"
                xml:lang="en"/>
        </preferred>
        <alternative></alternative>
    </concept>
    <concept dc:identifier="fe_cl_precipitation"
        dc:URI='http://gensc.org/ns/mixs/terms/vocabulary/virus_enrich_appr/fe_cl_precipitation'
        dc:description="">
        <preferred>
            <term dc:source="Genomic Standards Consortium MIxS Data Standard"
                dc:title="FeCl Precipitation"
                xml:lang="en"/>
        </preferred>
        <alternative></alternative>
    </concept>
    <concept dc:identifier="cs_cl_density_gradient"
        dc:URI='http://gensc.org/ns/mixs/terms/vocabulary/virus_enrich_appr/cs_cl_density_gradient'
        dc:description="">
        <preferred>
            <term dc:source="Genomic Standards Consortium MIxS Data Standard"
                dc:title="CsCl density gradient"
                xml:lang="en"/>
        </preferred>
        <alternative></alternative>
    </concept>
    <concept dc:identifier="DNAse"
        dc:URI='http://gensc.org/ns/mixs/terms/vocabulary/virus_enrich_appr/DNAse'
        dc:description="">
        <preferred>
            <term dc:source="Genomic Standards Consortium MIxS Data Standard"
                dc:title="DNAse"
                xml:lang="en"/>
        </preferred>
        <alternative></alternative>
    </concept>
    <concept dc:identifier="RNAse"
        dc:URI='http://gensc.org/ns/mixs/terms/vocabulary/virus_enrich_appr/RNAse'
        dc:description="">
        <preferred>
            <term dc:source="Genomic Standards Consortium MIxS Data Standard"
                dc:title="RNAse"
                xml:lang="en"/>
        </preferred>
        <alternative></alternative>
    </concept>
    <concept dc:identifier="targeted_sequence_capture"
        dc:URI='http://gensc.org/ns/mixs/terms/vocabulary/virus_enrich_appr/targeted_sequence_capture'
        dc:description="">
        <preferred>
            <term dc:source="Genomic Standards Consortium MIxS Data Standard"
                dc:title="targeted sequence capture"
                xml:lang="en"/>
        </preferred>
        <alternative></alternative>
    </concept>
    <concept dc:identifier="other"
        dc:URI='http://gensc.org/ns/mixs/terms/vocabulary/virus_enrich_appr/other'
        dc:description="">
        <preferred>
            <term dc:source="Genomic Standards Consortium MIxS Data Standard"
                dc:title="other"
                xml:lang="en"/>
        </preferred>
        <alternative></alternative>
    </concept>
    <concept dc:identifier="none"
        dc:URI='http://gensc.org/ns/mixs/terms/vocabulary/virus_enrich_appr/none'
        dc:description="">
        <preferred>
            <term dc:source="Genomic Standards Consortium MIxS Data Standard"
                dc:title="none"
                xml:lang="en"/>
        </preferred>
        <alternative></alternative>
    </concept>
</thesaurus>
    