<?xml version="1.0" encoding="UTF-8"?>
<?xml-stylesheet type="text/xsl" href="/style/human.xsl"?>
<thesaurus dc:URI='http://gensc.org/ns/mixs/terms/vocabulary/lib_layout/'
    dc:description="The library layout Vocabulary is a recommended set of values to use for the lib_layout term in the MIxS Extension."
    dc:title="Genomic Standards Consortium library layout Vocabulary"
    dc:issued="2020-04-24"
    dc:relation=""
    xmlns="http://rs.gbif.org/thesaurus/"
    xmlns:dc="http://purl.org/dc/terms/"
    xmlns:xsi="http://www.w3.org/2001/XMLSchema-instance"
    xsi:schemaLocation="http://rs.gbif.org/thesaurus/  http://rs.gbif.org/schema/thesaurus.xsd">
    <concept dc:identifier="paired"
        dc:URI='http://gensc.org/ns/mixs/terms/vocabulary/lib_layout/paired'
        dc:description="">
        <preferred>
            <term dc:source="Genomic Standards Consortium MIxS Data Standard"
                dc:title="paired"
                xml:lang="en"/>
        </preferred>
        <alternative></alternative>
    </concept>
    <concept dc:identifier="single"
        dc:URI='http://gensc.org/ns/mixs/terms/vocabulary/lib_layout/single'
        dc:description="">
        <preferred>
            <term dc:source="Genomic Standards Consortium MIxS Data Standard"
                dc:title="single"
                xml:lang="en"/>
        </preferred>
        <alternative></alternative>
    </concept>
    <concept dc:identifier="vector"
        dc:URI='http://gensc.org/ns/mixs/terms/vocabulary/lib_layout/vector'
        dc:description="">
        <preferred>
            <term dc:source="Genomic Standards Consortium MIxS Data Standard"
                dc:title="vector"
                xml:lang="en"/>
        </preferred>
        <alternative></alternative>
    </concept>
    <concept dc:identifier="other"
        dc:URI='http://gensc.org/ns/mixs/terms/vocabulary/lib_layout/other'
        dc:description="">
        <preferred>
            <term dc:source="Genomic Standards Consortium MIxS Data Standard"
                dc:title="other"
                xml:lang="en"/>
        </preferred>
        <alternative></alternative>
    </concept>
</thesaurus>
    