<?xml version="1.0" encoding="UTF-8"?>
<?xml-stylesheet type="text/xsl" href="/style/human.xsl"?>
<thesaurus dc:URI='http://gensc.org/ns/mixs/terms/vocabulary/compl_appr/'
  dc:description="The completeness approach Vocabulary is a recommended set of values to use for the compl_appr term in the MIxS Extension."
  dc:title="Genomic Standards Consortium completeness approach Vocabulary"
  dc:issued="2020-04-24"
  dc:relation=""
  xmlns="http://rs.gbif.org/thesaurus/"
  xmlns:dc="http://purl.org/dc/terms/"
  xmlns:xsi="http://www.w3.org/2001/XMLSchema-instance"
  xsi:schemaLocation="http://rs.gbif.org/thesaurus/  http://rs.gbif.org/schema/thesaurus.xsd">
  <concept dc:identifier="marker_gene"
    dc:URI='http://gensc.org/ns/mixs/terms/vocabulary/compl_appr/marker_gene'
    dc:description="">
    <preferred>
      <term dc:source="Genomic Standards Consortium MIxS Data Standard"
        dc:title="marker gene"
        xml:lang="en"/>
    </preferred>
    <alternative></alternative>
  </concept>
  <concept dc:identifier="reference_based"
    dc:URI='http://gensc.org/ns/mixs/terms/vocabulary/compl_appr/reference_based'
    dc:description="">
    <preferred>
      <term dc:source="Genomic Standards Consortium MIxS Data Standard"
        dc:title="reference based"
        xml:lang="en"/>
    </preferred>
    <alternative></alternative>
  </concept>
  <concept dc:identifier="other"
    dc:URI='http://gensc.org/ns/mixs/terms/vocabulary/compl_appr/other'
    dc:description="">
    <preferred>
      <term dc:source="Genomic Standards Consortium MIxS Data Standard"
        dc:title="other"
        xml:lang="en"/>
    </preferred>
    <alternative></alternative>
  </concept>
</thesaurus>
    