<?xml version="1.0" encoding="UTF-8"?>
<?xml-stylesheet type="text/xsl" href="/style/human.xsl"?>
<thesaurus 
    dc:URI="http://rs.nordgen.org/dwc/germplasm/0.1/vocabulary/TypeOfStorage"
    dc:description="Controlled vocabulary following the Multi-Crop Passport standard for term 27, Type of germplasm storage (STORAGE)." 
    dc:title="Type of germplasm storage"
    xmlns="http://rs.gbif.org/thesaurus/" 
    xmlns:dc="http://purl.org/dc/terms/" 
    xmlns:xsi="http://www.w3.org/2001/XMLSchema-instance" 
    xsi:schemaLocation="http://rs.gbif.org/thesaurus/ http://rs.gbif.org/schema/thesaurus.xsd">

    <concept dc:identifier="10" 
        dc:URI="http://rs.nordgen.org/dwc/germplasm/0.1/vocabulary/TypeOfStorage/10" 
        dc:description="Seed collection">
        <preferred>
            <term dc:source="Germplasm" dc:title="Seed collection (10)" xml:lang="en"/>
        </preferred>
        <alternative></alternative>
    </concept>

    <concept dc:identifier="11" 
        dc:URI="http://rs.nordgen.org/dwc/germplasm/0.1/vocabulary/TypeOfStorage/11" 
        dc:description="Short term">
        <preferred>
            <term dc:source="Germplasm" dc:title="Short term (11)" xml:lang="en"/>
        </preferred>
        <alternative></alternative>
    </concept>

    <concept dc:identifier="12" 
        dc:URI="http://rs.nordgen.org/dwc/germplasm/0.1/vocabulary/TypeOfStorage/12" 
        dc:description="Medium term">
        <preferred>
            <term dc:source="Germplasm" dc:title="Medium term (12)" xml:lang="en"/>
        </preferred>
        <alternative></alternative>
    </concept>

    <concept dc:identifier="13" 
        dc:URI="http://rs.nordgen.org/dwc/germplasm/0.1/vocabulary/TypeOfStorage/13" 
        dc:description="Long term">
        <preferred>
            <term dc:source="Germplasm" dc:title="Long term (13)" xml:lang="en"/>
        </preferred>
        <alternative></alternative>
    </concept>

    <concept dc:identifier="20" 
        dc:URI="http://rs.nordgen.org/dwc/germplasm/0.1/vocabulary/TypeOfStorage/20" 
        dc:description="Field collection">
        <preferred>
            <term dc:source="Germplasm" dc:title="Field collection (20)" xml:lang="en"/>
        </preferred>
        <alternative></alternative>
    </concept>

    <concept dc:identifier="30" 
        dc:URI="http://rs.nordgen.org/dwc/germplasm/0.1/vocabulary/TypeOfStorage/30" 
        dc:description="In vitro collection. Slow growth.">
        <preferred>
            <term dc:source="Germplasm" dc:title="In vitro collection (30)" xml:lang="en"/>
        </preferred>
        <alternative></alternative>
    </concept>

    <concept dc:identifier="40" 
        dc:URI="http://rs.nordgen.org/dwc/germplasm/0.1/vocabulary/TypeOfStorage/40" 
        dc:description="Cryopreserved collection">
        <preferred>
            <term dc:source="Germplasm" dc:title="Cryopreserved collection (40)" xml:lang="en"/>
        </preferred>
        <alternative></alternative>
    </concept>

    <concept dc:identifier="99" 
        dc:URI="http://rs.nordgen.org/dwc/germplasm/0.1/vocabulary/TypeOfStorage/99" 
        dc:description="Other type of germplasm storage, elaborate in remarks field">
        <preferred>
            <term dc:source="Germplasm" dc:title="Other (99)" xml:lang="en"/>
        </preferred>
        <alternative></alternative>
    </concept>

</thesaurus>
