<?xml version="1.0" encoding="UTF-8"?>
<?xml-stylesheet type="text/xsl" href="/style/human.xsl"?>
<thesaurus dc:URI='http://gensc.org/ns/mixs/terms/vocabulary/bin_software/'
    dc:description="The binning software Vocabulary is a recommended set of values to use for the bin_software term in the MIxS Extension."
    dc:title="Genomic Standards Consortium binning software Vocabulary"
    dc:issued="2020-04-24"
    dc:relation=""
    xmlns="http://rs.gbif.org/thesaurus/"
    xmlns:dc="http://purl.org/dc/terms/"
    xmlns:xsi="http://www.w3.org/2001/XMLSchema-instance"
    xsi:schemaLocation="http://rs.gbif.org/thesaurus/  http://rs.gbif.org/schema/thesaurus.xsd">
    <concept dc:identifier="metabat"
        dc:URI='http://gensc.org/ns/mixs/terms/vocabulary/bin_software/metabat'
        dc:description="">
        <preferred>
            <term dc:source="Genomic Standards Consortium MIxS Data Standard"
                dc:title="metabat"
                xml:lang="en"/>
        </preferred>
        <alternative></alternative>
    </concept>
    <concept dc:identifier="maxbin"
        dc:URI='http://gensc.org/ns/mixs/terms/vocabulary/bin_software/maxbin'
        dc:description="">
        <preferred>
            <term dc:source="Genomic Standards Consortium MIxS Data Standard"
                dc:title="maxbin"
                xml:lang="en"/>
        </preferred>
        <alternative></alternative>
    </concept>
    <concept dc:identifier="concoct"
        dc:URI='http://gensc.org/ns/mixs/terms/vocabulary/bin_software/concoct'
        dc:description="">
        <preferred>
            <term dc:source="Genomic Standards Consortium MIxS Data Standard"
                dc:title="concoct"
                xml:lang="en"/>
        </preferred>
        <alternative></alternative>
    </concept>
    <concept dc:identifier="groupm"
        dc:URI='http://gensc.org/ns/mixs/terms/vocabulary/bin_software/groupm'
        dc:description="">
        <preferred>
            <term dc:source="Genomic Standards Consortium MIxS Data Standard"
                dc:title="groupm"
                xml:lang="en"/>
        </preferred>
        <alternative></alternative>
    </concept>
    <concept dc:identifier="esom"
        dc:URI='http://gensc.org/ns/mixs/terms/vocabulary/bin_software/esom'
        dc:description="">
        <preferred>
            <term dc:source="Genomic Standards Consortium MIxS Data Standard"
                dc:title="esom"
                xml:lang="en"/>
        </preferred>
        <alternative></alternative>
    </concept>
    <concept dc:identifier="metawatt"
        dc:URI='http://gensc.org/ns/mixs/terms/vocabulary/bin_software/metawatt'
        dc:description="">
        <preferred>
            <term dc:source="Genomic Standards Consortium MIxS Data Standard"
                dc:title="metawatt"
                xml:lang="en"/>
        </preferred>
        <alternative></alternative>
    </concept>
    <concept dc:identifier="combination"
        dc:URI='http://gensc.org/ns/mixs/terms/vocabulary/bin_software/combination'
        dc:description="">
        <preferred>
            <term dc:source="Genomic Standards Consortium MIxS Data Standard"
                dc:title="combination"
                xml:lang="en"/>
        </preferred>
        <alternative></alternative>
    </concept>
    <concept dc:identifier="other"
        dc:URI='http://gensc.org/ns/mixs/terms/vocabulary/bin_software/other'
        dc:description="">
        <preferred>
            <term dc:source="Genomic Standards Consortium MIxS Data Standard"
                dc:title="other"
                xml:lang="en"/>
        </preferred>
        <alternative></alternative>
    </concept>
</thesaurus>
    