<?xml version="1.0" encoding="UTF-8"?>
<?xml-stylesheet type="text/xsl" href="/style/human.xsl"?>
<thesaurus dc:URI='http://gensc.org/ns/mixs/terms/vocabulary/pred_genome_struc/'
  dc:description="The predicted genome structure Vocabulary is a recommended set of values to use for the pred_genome_struc term in the MIxS Extension."
  dc:title="Genomic Standards Consortium predicted genome structure Vocabulary"
  dc:issued="2020-04-24"
  dc:relation=""
  xmlns="http://rs.gbif.org/thesaurus/"
  xmlns:dc="http://purl.org/dc/terms/"
  xmlns:xsi="http://www.w3.org/2001/XMLSchema-instance"
  xsi:schemaLocation="http://rs.gbif.org/thesaurus/  http://rs.gbif.org/schema/thesaurus.xsd">
  <concept dc:identifier="segmented"
    dc:URI='http://gensc.org/ns/mixs/terms/vocabulary/pred_genome_struc/segmented'
    dc:description="">
    <preferred>
      <term dc:source="Genomic Standards Consortium MIxS Data Standard"
        dc:title="segmented"
        xml:lang="en"/>
    </preferred>
    <alternative></alternative>
  </concept>
  <concept dc:identifier="non-segmented"
    dc:URI='http://gensc.org/ns/mixs/terms/vocabulary/pred_genome_struc/non-segmented'
    dc:description="">
    <preferred>
      <term dc:source="Genomic Standards Consortium MIxS Data Standard"
        dc:title="non-segmented"
        xml:lang="en"/>
    </preferred>
    <alternative></alternative>
  </concept>
  <concept dc:identifier="undetermined"
    dc:URI='http://gensc.org/ns/mixs/terms/vocabulary/pred_genome_struc/undetermined'
    dc:description="">
    <preferred>
      <term dc:source="Genomic Standards Consortium MIxS Data Standard"
        dc:title="undetermined"
        xml:lang="en"/>
    </preferred>
    <alternative></alternative>
  </concept>
</thesaurus>
    