<?xml version="1.0" encoding="UTF-8"?>
<?xml-stylesheet type="text/xsl" href="/style/human.xsl"?>
<thesaurus dc:URI='http://gensc.org/ns/mixs/terms/vocabulary/host_pred_appr/'
    dc:description="The host prediction approach Vocabulary is a recommended set of values to use for the host_pred_appr term in the MIxS Extension."
    dc:title="Genomic Standards Consortium host prediction approach Vocabulary"
    dc:issued="2020-04-24"
    dc:relation=""
    xmlns="http://rs.gbif.org/thesaurus/"
    xmlns:dc="http://purl.org/dc/terms/"
    xmlns:xsi="http://www.w3.org/2001/XMLSchema-instance"
    xsi:schemaLocation="http://rs.gbif.org/thesaurus/  http://rs.gbif.org/schema/thesaurus.xsd">
    <concept dc:identifier="provirus"
        dc:URI='http://gensc.org/ns/mixs/terms/vocabulary/host_pred_appr/provirus'
        dc:description="">
        <preferred>
            <term dc:source="Genomic Standards Consortium MIxS Data Standard"
                dc:title="provirus"
                xml:lang="en"/>
        </preferred>
        <alternative></alternative>
    </concept>
    <concept dc:identifier="host_sequence_similarity"
        dc:URI='http://gensc.org/ns/mixs/terms/vocabulary/host_pred_appr/host_sequence_similarity'
        dc:description="">
        <preferred>
            <term dc:source="Genomic Standards Consortium MIxS Data Standard"
                dc:title="host sequence similarity"
                xml:lang="en"/>
        </preferred>
        <alternative></alternative>
    </concept>
    <concept dc:identifier="crispr_spacer_match"
        dc:URI='http://gensc.org/ns/mixs/terms/vocabulary/host_pred_appr/crispr_spacer_match'
        dc:description="">
        <preferred>
            <term dc:source="Genomic Standards Consortium MIxS Data Standard"
                dc:title="CRISPR spacer match"
                xml:lang="en"/>
        </preferred>
        <alternative></alternative>
    </concept>
    <concept dc:identifier="kmer_similarity"
        dc:URI='http://gensc.org/ns/mixs/terms/vocabulary/host_pred_appr/kmer_similarity'
        dc:description="">
        <preferred>
            <term dc:source="Genomic Standards Consortium MIxS Data Standard"
                dc:title="kmer similarity"
                xml:lang="en"/>
        </preferred>
        <alternative></alternative>
    </concept>
    <concept dc:identifier="co-occurrence"
        dc:URI='http://gensc.org/ns/mixs/terms/vocabulary/host_pred_appr/co-occurrence'
        dc:description="">
        <preferred>
            <term dc:source="Genomic Standards Consortium MIxS Data Standard"
                dc:title="co-occurrence"
                xml:lang="en"/>
        </preferred>
        <alternative></alternative>
    </concept>
    <concept dc:identifier="combination"
        dc:URI='http://gensc.org/ns/mixs/terms/vocabulary/host_pred_appr/combination'
        dc:description="">
        <preferred>
            <term dc:source="Genomic Standards Consortium MIxS Data Standard"
                dc:title="combination"
                xml:lang="en"/>
        </preferred>
        <alternative></alternative>
    </concept>
    <concept dc:identifier="other"
        dc:URI='http://gensc.org/ns/mixs/terms/vocabulary/host_pred_appr/other'
        dc:description="">
        <preferred>
            <term dc:source="Genomic Standards Consortium MIxS Data Standard"
                dc:title="other"
                xml:lang="en"/>
        </preferred>
        <alternative></alternative>
    </concept>
</thesaurus>
    